{
  "generated_at": "2026-10-25T11:56:28.643775+00:00",
  "total_courses": 75,
  "total_providers": 139,
  "total_approvals": 643,
  "providers_with_dates": 50,
  "providers_with_prices": 30,
  "providers_requiring_manual_review": 0,
  "providers_blocking_automated_collection": 0,
  "providers_no_public_schedule": 89,
  "last_successful_full_refresh": "2026-10-25T11:56:28.643786+00:00",
  "parse_failures": []
}